Headings,Link,text_data,dates,Summary
"RBI to conduct 3-day Variable Rate Repo (VRR) auction under LAF on June 18, 2024",https://rbi.org.in/Scripts/BS_PressReleaseDisplay.aspx?prid=58110,"On a review of current and evolving liquidity conditions, it has been decided to conduct a Variable Rate Repo (VRR) auction on June 18, 2024, Tuesday, as under:2. The operational guidelines for the auction will be same as given in Reserve Bank’s Press Release 2021-2022/1572 dated January 20, 2022.(Puneet Pancholy)    Chief General ManagerPress Release: 2024-2025/513",18/06/2024,"The Reserve Bank of India (RBI) has announced that it will conduct a Variable Rate Repo (VRR) auction on June 18, 2024. The operational guidelines for the auction will be the same as those outlined in the RBI's Press Release 2021-2022/1572 dated January 20, 2022. This decision has been made after reviewing current and evolving liquidity conditions. (Puneet Pancholy) is the Chief General Manager making the announcement. The press release number is 2024-2025/513"
"Reserve Bank of India cancels the licence of Purvanchal Co-operative Bank Ltd., Ghazipur, Uttar Pradesh",https://rbi.org.in/Scripts/BS_PressReleaseDisplay.aspx?prid=58108,"The Reserve Bank of India (RBI), vide order dated June 14, 2024, has cancelled the licence of “Purvanchal Co-operative Bank Ltd., Ghazipur, Uttar Pradesh.” Consequently, the bank ceases to carry on banking business, with effect from the close of business on June 15, 2024. The Commissioner for Cooperation and Registrar of Cooperative Societies, Uttar Pradesh has also been requested to issue an order for winding up the bank and appoint a liquidator for the bank.The Reserve Bank cancelled the licence of the bank as:The bank does not have adequate capital and earning prospects. As such, it does not comply with the provisions of Section 11(1) and Section 22 (3) (d) read with Section 56 of the Banking Regulation Act, 1949.The bank has failed to comply with the requirements of Sections 22(3) (a), 22 (3) (b), 22(3)(c), 22(3) (d) and 22(3)(e) read with Section 56 of the Banking Regulation Act, 1949;The continuance of the bank is prejudicial to the interests of its depositors;The bank with its present financial position would be unable to pay its present depositors in full; andPublic interest would be adversely affected if the bank is allowed to carry on its banking business any further.2. Consequent to the cancellation of its licence, “Purvanchal Co-operative Bank Ltd., Ghazipur, Uttar Pradesh” is prohibited from conducting the business of ‘banking’ which includes, among other things, acceptance of deposits and repayment of deposits as defined in Section 5 (b) read with Section 56 of the Banking Regulation Act, 1949 with immediate effect.3. On liquidation, every depositor would be entitled to receive deposit insurance claim amount of his/her deposits up to a monetary ceiling of ₹5,00,000/- (Rupees five lakh only) from Deposit Insurance and Credit Guarantee Corporation (DICGC) subject to the provisions of DICGC Act, 1961. As per the data submitted by the bank, about 99.51% of the depositors are entitled to receive full amount of their deposits from DICGC. As on May 30, 2024, DICGC has already paid ₹12.63 crore of the total insured deposits under the provisions of Section 18A of the DICGC Act, 1961 based on the willingness received from the concerned depositors of the bank.(Puneet Pancholy)            Chief General ManagerPress Release: 2024-2025/511",15/06/2024,"The Reserve Bank of India has cancelled the license of Purvanchal Co-operative Bank in Uttar Pradesh due to insufficient capital and poor earning prospects. The bank failed to meet the requirements of the Banking Regulation Act, 1949, and its continuation would be detrimental to depositors' interests. The bank is prohibited from accepting deposits and repaying them immediately. Depositors are entitled to receive insurance claim amounts up to Rs 5 lakh from the Deposit Insurance and Credit Guarantee Corporation, subject to the DICGC Act, 1961. About 99.51% of depositors are eligible for full payment."
"Premature redemption under Sovereign Gold Bond (SGB) Scheme - Redemption Price for premature redemption due on June 18, 2024 (Series XII of SGB 2017-18)",https://rbi.org.in/Scripts/BS_PressReleaseDisplay.aspx?prid=58107,"In terms of GOI Notification F.No. 4(25) - W&M/2017 dated October 06, 2017 (SGB 2017-18 Series XII-Issue date December 18, 2017) on Sovereign Gold Bond Scheme, premature redemption of Gold Bond may be permitted after fifth year from the date of issue of such Gold Bond on the date on which interest is payable. Accordingly, the next due date of premature redemption of the above tranche shall be on June 18, 2024.2. Further, the redemption price of SGB shall be based on simple average of closing gold price of 999 purity of previous three business days from the date of redemption as published by the India Bullion and Jewellers Association Ltd (IBJA). Accordingly, the redemption price for premature redemption due on June 18, 2024, shall be ₹7165/- (Rupees Seven thousand one hundred and sixty-five only) per unit of SGB based on the simple average of closing gold price for the three business days i.e., June 12, to 14, 2024. Ajit Prasad              Deputy General Manager    (Communications)    Press Release: 2024-2025/510",14/06/2024,"The Reserve Bank of India has announced that premature redemption of Sovereign Gold Bonds issued in December 2017 will be allowed after five years from the date of issue, starting from June 18, 2024. The redemption price will be based on the simple average of the closing gold price of the previous three business days before the date of redemption, as published by the India Bullion and Jewellers Association Ltd. The redemption price for the premature redemption due on June 18, 2024, will be Rs 7165/- (Rupees Seven thousand one hundred and sixty-five only) per unit of SGB based on the simple average of closing gold prices for the three business days from June 12 to 14, 2024. This announcement was made in accordance with the Government of India notification F.No. 4(25) - W&M/2017 dated October 06, 2017."
Auction of Government of India Dated Securities,https://rbi.org.in/Scripts/BS_PressReleaseDisplay.aspx?prid=58106,"Government of India (GOI) has announced the sale (re-issue) of two dated securities for a notified amount of ₹23,000 crore as per the following details:2. GoI will have the option to retain additional subscription up to ₹2,000 crore against each security mentioned above.3. The securities will be sold through Reserve Bank of India Mumbai Office, Fort, Mumbai – 400001. The sale will be subject to the terms and conditions spelt out in the ‘Specific Notification’ mentioned above and the General Notification F.No.4(2)–W&M/2018, dated March 27, 2018.4. The auction will be conducted using multiple price method for 7.04% GS 2029 and 7.46% GS 2073. Both competitive and non-competitive bids for the auction should be submitted in electronic format on the Reserve Bank of India Core Banking Solution (E-Kuber) system on June 21, 2024 (Friday). The non-competitive bids should be submitted between 10:30 a.m. and 11:00 a.m. and the competitive bids should be submitted between 10:30 a.m. and 11:30 a.m. The result will be announced on the same day and payment by successful bidders will have to be made on June 24, 2024 (Monday).5. Bids for underwriting of the Additional Competitive Underwriting (ACU) portion can be submitted by ‘Primary Dealers’ from 09:00 a.m. up to 09:30 a.m. on June 21, 2024 (Friday) on the Reserve Bank of India Core Banking Solution (E-Kuber) system.6. The Stocks will be eligible for “When Issued” trading for a period commencing from June 18 – June 21, 2024.7. Operational guidelines for Government of India dated securities auction and other details are given in the Annex.Ajit Prasad                Deputy General Manager      (Communications)    Press Release: 2024-2025/509ANNEXType of Auction1. For multiple price-based auction, successful bids will get accepted at the respective quoted yield/price for the security. For uniform price-based auction, bids will get accepted at the cut off yield/price accepted in the auction.2. The auction will be yield based for new security and price based for securities which are re-issued.3. In case of a Floating Rate Bonds (FRB), the auction will be spread-based for new security and price based for securities which are reissued. At the time of placing bids for new FRB, the spread should be quoted in percentage terms.Minimum Bid Size4. The Stocks will be issued for a minimum amount of ₹10,000/- (nominal) and in multiples of ₹10,000/- thereafter.Non-Competitive Segment5. In all the auctions, Government Stock up to 5% of the notified amount of sale will be allotted to the eligible individuals and institutions under the Scheme for Non-competitive Bidding Facility in the Auctions of Government Securities. Individual investors can also place bids as per the non-competitive scheme through the Retail Direct portal (https://rbiretaildirect.org.in).6. Each bank or Primary Dealer (PD) on the basis of firm orders received from their constituents will submit a single consolidated non-competitive bid on behalf of all its constituents in electronic format on the Reserve Bank of India Core Banking Solution (E-Kuber) system.7. Allotment under the non-competitive segment to the bank or PD will be at the weighted average rate of yield/price of the successful bids that will emerge in the auction on the basis of the competitive bidding.Submission of Bids8. Both competitive and non-competitive bids for the auction should be submitted in electronic format on the Reserve Bank of India Core Banking Solution (E-Kuber) system.9. Bids in physical form will not be accepted except in extraordinary circumstances.Business Continuity Plan (BCP)-IT failure10. Only in the event of system failure, physical bids will be accepted. Such physical bids should be submitted to the Public Debt Office, Mumbai through (email; Phone no: 022-22603456, 022-22603457, 022-22603190) in the prescribed form which can be obtained from RBI website (https://www.rbi.org.in/Scripts/BS_ViewForms.aspx) before the auction timing ends.11. In case of technical difficulties, Core Banking Operations Team should be contacted (email; Phone no: 022-69870466, 022-69870415).12. For other auction related difficulties, IDMD auction team can be contacted (email; Phone no: 022-22702431, 022-22705125).Multiple Bids13. An investor can submit more than one competitive bid in electronic format on the Reserve Bank of India Core Banking Solution (E-Kuber) system.14. However, the aggregate amount of bids submitted by an investor in an auction should not exceed the notified amount of auction.Decision Making Process15. On the basis of bids received, the Reserve Bank will determine the minimum price/maximum yield up to which tenders for purchase of Government Stock will be accepted at the auctions.16. Bids quoted at rates lower than the minimum price/higher than the maximum yield determined by the Reserve Bank of India will be rejected.17. Reserve Bank of India will have the full discretion to accept or reject any or all bids either wholly or partially without assigning any reason.Issue of Securities18. Issue of securities to the successful bidders will be by credit to Subsidiary General Ledger Account (SGL) of parties maintaining such account with Reserve Bank of India or in the form of Stock Certificate.Periodicity of Interest Payment19. Interest on the Government Stock will generally be paid half-yearly other than in case of securities with non-standard maturities. The exact periodicity of coupon payment is invariably mentioned in the specific notification for the issue of security.Underwriting of the Government Securities20. The underwriting of the Government Securities under auctions by the ‘Primary Dealers’ will be as per the “Revised Scheme of Underwriting Commitment and Liquidity Support” announced by the Reserve Bank vide circular RBI/2007-08/186 dated November 14, 2007 as amended from time to time.Eligibility for Repurchase Transactions (Repo)21. The Stocks will be eligible for Repurchase Transactions (Repo) as per the conditions mentioned in Repurchase Transactions (Repo) (Reserve Bank) Directions, 2018 (Reserve Bank) Directions, 2018 as amended from time to time.Eligibility for ‘When Issued’ Trading22. The Stocks will be eligible for “When Issued” trading in accordance with the guidelines on ‘When Issued transactions in Central Government Securities’ issued by the Reserve Bank of India vide circular No. RBI/2018-19/25 dated July 24, 2018 as amended from time to time.Investment by Non-Residents23. Investments by Non-Residents are subject to the guidelines on ‘Fully Accessible Route’ for Investment by Non-residents in Government Securities and other related guidelines as issued by the Reserve Bank from time to time.",14/06/2024,"The Reserve Bank of India has announced the sale of two dated securities worth Rs 23,000 crore through auction. The securities, with maturities of 2029 and 2073, will be sold using the multiple price method, and both competitive and non-competitive bids are accepted. The auction will be yield-based for new securities and price-based for reissued securities. The auction will also have a non-competitive segment for individual investors and institutions, with a maximum limit of 5% of the notified amount of sale. Bids can be submitted electronically, and physical bids will be accepted only in the event of system failure. The Reserve Bank will determine the minimum price/maximum yield based on the bids received, and interest on the securities will generally be paid half-yearly. The securities will be eligible for repo transactions and ""When Issued"" trading, subject to certain conditions. Non-residents can also invest in these securities under the guidelines for the Fully Accessible Route."
"91 days, 182 days and 364 days Treasury Bills auction",https://rbi.org.in/Scripts/BS_PressReleaseDisplay.aspx?prid=58105,"Reserve Bank of India announces the auction of Government of India Treasury Bills as per the following details:The sale will be subject to the terms and conditions specified in the General Notification F.No.4(2)-W&M/2018 dated March 27, 2018 along with the Amendment Notification No.F.4(2)-W&M/2018 dated April 05, 2018 and Amendment Notification No.F-4(2)-W&M/2018 dated December 23, 2021, issued by Government of India, as amended from time to time. State Governments, Union Territories with legislature, eligible Provident Funds in India, designated Foreign Central Banks and any person or institution specified by the Bank in this regard, can participate on non-competitive basis, the allocation for which will be outside the notified amount. Individuals can also participate on non-competitive basis as retail investors. For retail investors, the allocation will be restricted to a maximum of 5 percent of the notified amount. Individual investors can also place bids as per the non-competitive scheme through Retail Direct portal (https://rbiretaildirect.org.in).The auction will be Price based using multiple price method. Bids for the auction should be submitted in electronic format on the Reserve Bank of India’s Core Banking Solution (E-Kuber) system on Wednesday, June 19, 2024, during the below given timings:Results will be announced on the day of the auction. Payment by successful bidders will have to be made on Thursday, June 20, 2024.Only in the event of system failure, physical bids would be accepted. Such physical bids should be submitted to the Public Debt Office (email; Phone no: 022-22603456, 022-22603457, 022-22603190) in the prescribed form obtainable from RBI website (https://www.rbi.org.in/Scripts/BS_ViewForms.aspx) before the auction timing ends. In case of technical difficulties, Core Banking Operations Team should be contacted (email; Phone no: 022-69870466, 022-69870415). For other auction related difficulties, IDMD auction team can be contacted (email; Phone no: 022-22702431, 022-22705125).Ajit Prasad              Deputy General Manager    (Communications)    Press Release: 2024-2025/507",14/06/2024,"The Reserve Bank of India has announced an auction for Government of India Treasury Bills, with details provided in previous notifications. Eligible participants include state governments, designated foreign central banks, and retail investors, with a maximum allocation of 5% for individuals. The auction will use a price-based method with multiple prices, and bids must be submitted electronically through the RBI's Core Banking Solution system. Physical bids are only accepted in the event of system failure, and should be submitted to the Public Debt Office before the auction timing ends. Results will be announced on the day of the auction, and successful bidders must make payment the following day. Contact information is provided for technical and auction-related difficulties"
RBI imposes monetary penalty on Sonali Bank PLC,https://rbi.org.in/Scripts/BS_PressReleaseDisplay.aspx?prid=58103,"The Reserve Bank of India (RBI) has, by an order dated June 10, 2024, imposed a monetary penalty of ₹96.40 Lakh (Rupees Ninety Six Lakh and Forty Thousand only) on Sonali Bank PLC (the bank) for contravention of sub-section (1) of Section 15 of the Credit Information Companies (Regulation) Act, 2005 [CIC (R) Act] and the directions issued by RBI under the provisions of the CIC (R) Act on ‘Membership of Credit Information Companies (CICs)’, non-compliance with the ‘Reserve Bank of India (Know Your Customer (KYC)) Directions, 2016’ and the directions issued by RBI on ‘Time-bound implementation and strengthening of SWIFT – related operational controls’. This penalty has been imposed in exercise of powers vested in RBI conferred under the provisions of Section 47A(1)(c) read with Section 46(4)(i) of the Banking Regulation Act, 1949 (BR Act) and Section 25(1)(iii) read with Section 23(4) of the CIC (R) Act.The Statutory Inspection for Supervisory Evaluation (ISE 2022) of the bank was conducted by RBI with reference to its financial position as on March 31, 2022 and Information Technology (IT) examination of the bank was carried out by RBI in March 2022. Based on supervisory findings of non-compliance with RBI directions, contravention of provisions of the CIC (R) Act and related correspondence in that regard, a notice was issued to the bank advising it to show cause as to why penalty should not be imposed on it for its failure to comply with the said provisions of CIC (R) Act and the directions issued under BR Act and CIC (R) Act. After considering the bank’s reply to the notice, oral submissions made during the personal hearing and examination of additional submissions made by it, RBI found, inter alia, that the following charges against the bank were sustained, warranting imposition of monetary penalty. The bank had failed to (i) put in place a system of periodic review of risk categorisation of accounts, (ii) put in use a robust software throwing alerts for transactions inconsistent with risk categorisation and updated profile of the customers, (iii) implement certain SWIFT-related operational controls within the stipulated timelines and (iv) become a member of all the CICs within the stipulated timeline.The action is based on deficiencies in statutory and regulatory compliance and is not intended to pronounce upon the validity of any transactions or agreement entered into by the bank with its customers. Further, imposition of monetary penalty is without prejudice to any other action that may be initiated by RBI against the bank.(Puneet Pancholy)       Chief General ManagerPress Release: 2024-2025/508",14/06/2024,"The Reserve Bank of India (RBI) has fined Sonali Bank PLC Rs 96.40 lakh for violating the Credit Information Companies (Regulation) Act, 2005 and not complying with the Know Your Customer (KYC) directions and SWIFT-related operational controls. The penalty was imposed following a supervisory inspection and IT examination in 2022, which revealed non-compliance with RBI directions and the CIC (R) Act. The bank failed to implement a system for reviewing risk categorisation, use a software for inconsistent transactions, and become a member of all CICs within the stipulated timeline. The action does not affect the validity of any transactions or agreements with customers."
RBI imposes monetary penalty on Central Bank of India,https://rbi.org.in/Scripts/BS_PressReleaseDisplay.aspx?prid=58104,"The Reserve Bank of India (RBI) has, by an order dated June 11, 2024 imposed a monetary penalty of ₹1,45,50,000 (Rupees One Crore Forty Five Lakh Fifty Thousand only) on Central Bank of India (the bank) for non-compliance with certain directions issued by RBI on ‘Loans and Advances – Statutory and Other Restrictions’ and ‘Customer Protection – Limiting Liability of Customers in Unauthorised Electronic Banking Transactions’. This penalty has been imposed in exercise of powers vested in RBI conferred under the provisions of section 47 A (1) (c) read with sections 46 (4) (i) and section 51(1) of the Banking Regulation Act, 1949.The Statutory Inspection for Supervisory Evaluation (ISE 2022) of the bank was conducted by RBI with reference to its financial position as on March 31, 2022. Based on supervisory findings of non-compliance with RBI directions and related correspondence in that regard, a notice was issued to the bank advising it to show cause as to why penalty should not be imposed on it for its failure to comply with the directions. After considering the bank’s reply to the notice, oral submissions made during the personal hearing and examination of additional submissions made by it, RBI found, inter alia, that the following charges against the bank were sustained, warranting imposition of monetary penalty. The bank (i) sanctioned a working capital demand loan to a Corporation against amounts receivable from Government by way of subsidies, and (ii) failed to credit (shadow reversal) the amount involved in a few instances of unauthorised electronic transaction to the customer’s account within 10 working days from the date of notification by the customer and resolve complaints and provide compensation to certain customers within 90 days from the date of receipt of such complaints.The action is based on deficiencies in regulatory compliance and is not intended to pronounce upon the validity of any transactions or agreement entered into by the bank with its customers. Further, imposition of monetary penalty is without prejudice to any other action that may be initiated by RBI against the bank.(Puneet Pancholy)    Chief General ManagerPress Release: 2024-2025/506",14/06/2024,"The Reserve Bank of India (RBI) has fined Central Bank of India Rs 1.45 crore for violating regulatory directions related to loans and customer protection. The penalty was imposed following a supervisory inspection in 2022, which found that the bank had sanctioned a loan against subsidies and failed to credit unauthorised electronic transactions within the required timeframe. The action is not intended to affect the validity of any transactions or agreements between the bank and its customers."
