Summary,Link
Monetary Policy Report,https://www.federalreserve.gov//monetarypolicy/publications/mpr_default.htm
"Minutes of the Federal Open Market Committee, June 11–12, 2024",https://www.federalreserve.gov//newsevents/pressreleases/monetary20240703a.htm
Federal Reserve Board fines Silvergate Capital Corporation and Silvergate Bank $43 million for deficiencies in Silvergate’s monitoring of transactions in compliance with anti-money laundering law,https://www.federalreserve.gov//newsevents/pressreleases/enforcement20240701a.htm
Federal Reserve Board announces its approval of the application by PlainsCapital Bank,https://www.federalreserve.gov//newsevents/pressreleases/orders20240627a.htm
"Remarks by Governor Bowman on the economy, monetary policy, and bank regulation",https://www.federalreserve.gov//newsevents/speech/bowman20240627a.htm
"Federal Reserve Board annual bank stress test showed that while large banks would endure greater losses than last year's test, they are well positioned to weather a severe recession and stay above minimum capital requirements",https://www.federalreserve.gov//newsevents/pressreleases/bcreg20240626a.htm
Federal Reserve Board announces its approval of the application by Veritex Community Bank,https://www.federalreserve.gov//newsevents/pressreleases/orders20240626a.htm
Speech by Governor Bowman on the consequences of bank capital reform,https://www.federalreserve.gov//newsevents/speech/bowman20240626a.htm
